Title,Score,Comments,URL
Bitcoin Newcomers FAQ - Please read!,125,31,https://www.reddit.com/r/Bitcoin/comments/1jwz2d3/bitcoin_newcomers_faq_please_read/
"Daily Discussion, September 07, 2025",17,6,https://www.reddit.com/r/Bitcoin/comments/1nalnr6/daily_discussion_september_07_2025/
BTC,125,3,https://i.redd.it/ufmetmft3qnf1.jpeg
GM Bitcoiners ☕️,115,4,https://i.redd.it/knpmtmxrnpnf1.jpeg
Rate my setup!,91,27,https://i.redd.it/pne3etunwpnf1.jpeg
The view and the climb,63,2,https://v.redd.it/6qtcl6o4cqnf1
Its so true!!!,576,39,https://i.redd.it/tfqozcv7hmnf1.jpeg
Who gives a fuck sunday,55,10,https://www.reddit.com/r/Bitcoin/comments/1naofs2/who_gives_a_fuck_sunday/
"If you're still waiting for the perfect Sunday dip, good luck 😅
You'll never see Bitcoin at $100K again. Time to face the new reality.",298,223,https://www.reddit.com/r/Bitcoin/comments/1nacuk6/if_youre_still_waiting_for_the_perfect_sunday_dip/
BTC is limited. Fiat is not.,65,33,https://www.reddit.com/r/Bitcoin/comments/1nalu8z/btc_is_limited_fiat_is_not/
You can buy Bitcoin with cash at train stations in Switzerland 🇨🇭,282,37,https://i.redd.it/ecwwv95x0mnf1.jpeg
S&P500 normalized by CPI and M2,164,11,https://www.reddit.com/gallery/1nae8w0
DCA for my son,17,14,https://www.reddit.com/r/Bitcoin/comments/1naq7k7/dca_for_my_son/
Why I decided to sell,58,89,https://www.reddit.com/r/Bitcoin/comments/1naj7wk/why_i_decided_to_sell/
I am about to buy,368,52,https://www.reddit.com/r/Bitcoin/comments/1na5sxp/i_am_about_to_buy/
Most people stuck in survival mode need our help to guide them!,98,6,https://i.redd.it/j9optvccwmnf1.jpeg
"Daily Bitcoin meme until BTC is at $200,000 #83",425,6,https://i.redd.it/hdniunmvhknf1.png
Why does it have to be generational wealth?,9,7,https://www.reddit.com/r/Bitcoin/comments/1nasg67/why_does_it_have_to_be_generational_wealth/
Which target in the next year?,55,152,https://i.redd.it/4m5f3fcknnnf1.jpeg
Bitcoin only,483,46,https://i.redd.it/nincryvd3knf1.jpeg
i get so hype when i buy,30,5,https://www.reddit.com/r/Bitcoin/comments/1nakxso/i_get_so_hype_when_i_buy/
I’m node setup!!,7,3,https://v.redd.it/9miy4bg6mqnf1
This is why we Bitcoin! The FDIC Literally Says the Financial System is Collapsing and the Public Must Not Be Told,267,50,https://v.redd.it/2llmr3hgkknf1
We visited the 2nd largest bitcoin miner manufacturer in China,8,0,https://youtu.be/zSMQ1olHMgY
I sold 100 BTC in 2017 for 1.5M USD - here's how I feel about it,3148,442,https://www.reddit.com/r/Bitcoin/comments/1n9m4f1/i_sold_100_btc_in_2017_for_15m_usd_heres_how_i/
Bitcoin fixes this,29,4,https://i.redd.it/jpszubw0ennf1.jpeg
Bitcoin is a Volcano,4,1,https://www.reddit.com/r/Bitcoin/comments/1nar9a3/bitcoin_is_a_volcano/
😩😩🤣🤣🤣🤦🏻‍♂️🤦🏻‍♂️💯💯💯,3,0,https://i.redd.it/98jasftbvqnf1.jpeg
Is the Fear & Greed index still relevant?,3,0,https://i.redd.it/kkmohx73pqnf1.jpeg
Finally reached 0.15. DCA is best for me,90,19,https://i.redd.it/ap93j8cq5lnf1.jpeg
Stacker News,3,2,https://www.reddit.com/r/Bitcoin/comments/1narz07/stacker_news/
Just 0.02 bitcoin,112,50,https://www.reddit.com/r/Bitcoin/comments/1na4d9f/just_002_bitcoin/
Bitcoin lending options?,3,4,https://www.reddit.com/r/Bitcoin/comments/1narh0l/bitcoin_lending_options/
Only buy the top,317,14,https://i.redd.it/v3s8xj1irinf1.jpeg
"clueless here, can I exchange this for USD??",3,11,https://i.redd.it/m75zolu29qnf1.jpeg
Are FOMO people the same as YOLO people?,2,1,https://www.reddit.com/r/Bitcoin/comments/1nasdmd/are_fomo_people_the_same_as_yolo_people/
"how to import legacy wallet string key in Sparrow (~50 Chars, no header)",4,4,https://www.reddit.com/r/Bitcoin/comments/1naocn8/how_to_import_legacy_wallet_string_key_in_sparrow/
"Bitcoin close 2015 $430, What is your Prediction for 2025?",55,34,https://i.redd.it/mcnp5ly5tknf1.jpeg
SHORT,0,1,https://www.reddit.com/r/Bitcoin/comments/1nat4fi/short/
Bitcoin feels like it’s gearing up for something big,97,45,https://www.reddit.com/r/Bitcoin/comments/1n9ycg2/bitcoin_feels_like_its_gearing_up_for_something/
This comment of mine aged like fine wine !,103,6,https://i.redd.it/i36a9bz9bjnf1.jpeg
Why I save 100% of my money in bitcoin at 29,0,0,https://www.youtube.com/watch?v=sybYyQSTofE
Investing in Bitcoin with a Part-Time Job: Is It Worth It?,19,24,https://www.reddit.com/r/Bitcoin/comments/1na9j0y/investing_in_bitcoin_with_a_parttime_job_is_it/
How much r/investing hates bitcoin,1146,152,https://www.reddit.com/gallery/1n9hwrp
BTC will be the largest asset in the world 🌍,828,78,https://i.redd.it/vc9a29ubgfnf1.jpeg
It’s happening,689,151,https://www.reddit.com/gallery/1n9klkf
Is Bitcoin really intended to be a currency?,23,111,https://www.reddit.com/r/Bitcoin/comments/1na68r2/is_bitcoin_really_intended_to_be_a_currency/
Exec Ord 6102 was signed on Apr 5 1933 the same year a theorem important for Bitcoin was proven. Satoshi's bday is Apr 5 (1975 see below). The Fed's inept actions helped worsen the great depression instead of dampening the business cycle. A motif in this work is based on a rat on a cycle...,246,13,https://i.redd.it/0wawiobk5knf1.jpeg
Whenever you are thinking about what you should do today… zoom out!,6,0,https://www.reddit.com/r/Bitcoin/comments/1nael2w/whenever_you_are_thinking_about_what_you_should/
What do you think about side-chains anchored to Bitcoin?,7,6,https://www.reddit.com/r/Bitcoin/comments/1nabp46/what_do_you_think_about_sidechains_anchored_to/
Can I set up a bitcoin account for someone else,3,24,https://www.reddit.com/r/Bitcoin/comments/1nahb44/can_i_set_up_a_bitcoin_account_for_someone_else/
Is this cycle different?,20,50,https://www.reddit.com/r/Bitcoin/comments/1na1obh/is_this_cycle_different/
It’s happening in a weird way,135,17,https://www.reddit.com/gallery/1n9qi3v
Bitcoin Will Fix This📈🚀🥳,169,0,https://i.redd.it/xzqp6ev4mgnf1.jpeg
Satoshi giving us bitcoin,622,14,https://i.redd.it/mlgwuldmeenf1.jpeg
"If you bought at $124,128 August 14, 2025",310,100,https://www.reddit.com/r/Bitcoin/comments/1n9jzf3/if_you_bought_at_124128_august_14_2025/
Only BTC,34,1,https://i.redd.it/k8ee5w0jzinf1.jpeg
Trezor Safe 5 Bitcoin,10,9,https://www.reddit.com/r/Bitcoin/comments/1na4uaw/trezor_safe_5_bitcoin/
Fiat currency got you down?,64,4,https://i.redd.it/b6ld8v6vqhnf1.jpeg
The only wrong button is none,38,2,https://i.redd.it/a77zqc0ilinf1.jpeg
Bitcoin distribution between addresses. 1 year ago compared to today. Lots of stacking going on in the lower tiers and the 100-1000 level!,94,30,https://www.reddit.com/gallery/1n9ph8a
Just going to leave this here,9,4,https://i.redd.it/8c3o09l7pknf1.jpeg
"Just 22,000 jobs were added in August, compared to expectations for 76,500 new roles",20,12,https://www.reddit.com/r/Bitcoin/comments/1n9xeup/just_22000_jobs_were_added_in_august_compared_to/
Anyone buy bitcoin ETF in IBKR? What are the requirement to enable permission to trade this?,3,7,https://i.redd.it/qf4dwcganlnf1.jpeg
About next wave,0,25,https://www.reddit.com/r/Bitcoin/comments/1nai9dl/about_next_wave/
Should I sale some of my bitcoin to expand my auto repair business or just Hold on to my bitcoin and wait.,13,19,https://www.reddit.com/r/Bitcoin/comments/1n9xw91/should_i_sale_some_of_my_bitcoin_to_expand_my/
BTC can fix the world instead,375,121,https://i.redd.it/msjbszdaqdnf1.jpeg
"Daily Discussion, September 06, 2025",29,20,https://www.reddit.com/r/Bitcoin/comments/1n9s3op/daily_discussion_september_06_2025/
Sora Ventures to Back Bitcoin Treasury Firms in Asia with $1B Fund,9,0,https://www.bitcoininsider.org/article/285601/sora-ventures-back-bitcoin-treasury-firms-asia-1b-fund
Who is bullish on Bitcoin? 🚀,0,2,https://i.redd.it/rxg6ng9czpnf1.jpeg
I interviewed a Bitcoin expert in 2013… and didn’t buy a single coin 🤦‍♂️,768,183,https://www.reddit.com/r/Bitcoin/comments/1n9367q/i_interviewed_a_bitcoin_expert_in_2013_and_didnt/
How much Bitcoin is enough for true financial freedom?,0,34,https://www.reddit.com/r/Bitcoin/comments/1nancpx/how_much_bitcoin_is_enough_for_true_financial/
Bitcoin Treasury Charity,14,2,https://i.redd.it/aok327tm1inf1.jpeg
This is why I stack,204,21,https://i.redd.it/3qd5ue8lqdnf1.jpeg
"Daily Bitcoin meme until BTC is at $200,000 #82",95,1,https://i.redd.it/cq64wxppzenf1.jpeg
"We’re going to $150,000 now. 🥳GET IN, LOSER 🤣🤣😅📈🚀",1635,73,https://i.redd.it/jegfyb9jcanf1.jpeg
New to Bitcoin: When and How Should a Beginner Start?,1,8,https://www.reddit.com/r/Bitcoin/comments/1nabmxc/new_to_bitcoin_when_and_how_should_a_beginner/
300k to Invest should I lump sump or Dca,22,85,https://www.reddit.com/r/Bitcoin/comments/1n9qtm4/300k_to_invest_should_i_lump_sump_or_dca/
Bitcoin Logistics Inc.,0,4,https://www.reddit.com/r/Bitcoin/comments/1nag1dd/bitcoin_logistics_inc/
How buy bitcoin by p2p,0,5,https://www.reddit.com/r/Bitcoin/comments/1naankn/how_buy_bitcoin_by_p2p/
Who gives a fuck friday,138,32,https://www.reddit.com/r/Bitcoin/comments/1n9bvhe/who_gives_a_fuck_friday/
The Coinbase One card is here!,85,179,https://www.reddit.com/r/Bitcoin/comments/1n9fl83/the_coinbase_one_card_is_here/
Vader,45,1,https://i.redd.it/5e7bei9ibfnf1.jpeg
What is BTC?,1,20,https://www.reddit.com/r/Bitcoin/comments/1na8jkk/what_is_btc/
Should I put 10k into bitcoin?,366,412,https://www.reddit.com/r/Bitcoin/comments/1n922qe/should_i_put_10k_into_bitcoin/
Bitcoin has no top,296,16,https://i.redd.it/dubzv00x5cnf1.png
I'll Pass,78,6,https://v.redd.it/aowrd6on5enf1
IBIT vs Bitcoin,0,10,https://www.reddit.com/r/Bitcoin/comments/1na6j4b/ibit_vs_bitcoin/
Market volatility,16,14,https://www.reddit.com/r/Bitcoin/comments/1n9nzqh/market_volatility/
Bitcoin difficulty spike 🚀,7,1,https://www.reddit.com/r/Bitcoin/comments/1n9tu1c/bitcoin_difficulty_spike/
One fact about Bitcoin,28,39,https://www.reddit.com/r/Bitcoin/comments/1n9kai4/one_fact_about_bitcoin/
Study Bitcoin and you'll be 30 years ahead of other people,39,9,https://v.redd.it/hblm1izxyenf1
Latest status of the Osprey Bitcoin Trust (OBTC)?,0,0,https://www.reddit.com/r/Bitcoin/comments/1na3hxw/latest_status_of_the_osprey_bitcoin_trust_obtc/
The people at Netflix really dissed BTC here,142,8,https://i.redd.it/w20h48bjicnf1.jpeg
"I cry, I weep 😭",0,21,https://www.reddit.com/r/Bitcoin/comments/1nacuqi/i_cry_i_weep/
Bitcoin Knots 29.1.knots20250903 released! 🎉,22,8,https://bitcoinknots.org/?29.1?reddit
buckle up boys we goin' up,61,5,https://i.redd.it/grua2zvfucnf1.png
Well that's a start,15,0,https://i.redd.it/wasnwkmsyenf1.png
Real screenshots from my account. My bank didn't tell me at the Time that they had to pre aprove a SEPA,60,20,https://www.reddit.com/gallery/1n96csf
Fidelity Predicts: $1B per 1 BTC by 2038 — 2040?,100,140,https://www.reddit.com/r/Bitcoin/comments/1n91syv/fidelity_predicts_1b_per_1_btc_by_2038_2040/
